{
  "status": "success",
  "payload": {
    "summary": "Workflow orchestration completed with parallel stages",
    "handoffs": []
  },
  "diagnostics": {
    "notes": ["run_mode=production"],
    "metrics": {
      "runtime_ms": 2800,
      "workflow.stages_completed": 6
    }
  },
  "artifacts": {
    "workflow_log": "logs/agents/main-agents/workflow-mag/session-20251014-001.json"
  }
}
